{
  "contract": "blux.policy",
  "contract_version": "1.0",
  "default_effect": "deny",
  "policy_id": "blux.reference",
  "rules": [
    {
      "capabilities": [
        "echo.*"
      ],
      "effect": "allow",
      "max_side_effects": "none",
      "rule_id": "allow-echo"
    },
    {
      "actor_types": [
        "agent"
      ],
      "capabilities": [
        "fs.delete"
      ],
      "effect": "deny",
      "grants": [
        "fs:write"
      ],
      "rule_id": "deny-agents-destructive"
    }
  ]
}
